<?xml version="1.0" encoding="UTF-8"?>
<!DOCTYPE configuration SYSTEM "../share/configuration.dtd">
<!--
        	

        Copyright  1990-2007 Sun Microsystems, Inc. All Rights Reserved.
        DO NOT ALTER OR REMOVE COPYRIGHT NOTICES OR THIS FILE HEADER
        
        This program is free software; you can redistribute it and/or
        modify it under the terms of the GNU General Public License version
        2 only, as published by the Free Software Foundation.
        
        This program is distributed in the hope that it will be useful, but
        WITHOUT ANY WARRANTY; without even the implied warranty of
        MERCHANTABILITY or FITNESS FOR A PARTICULAR PURPOSE. See the GNU
        General Public License version 2 for more details (a copy is
        included at /legal/license.txt).
        
        You should have received a copy of the GNU General Public License
        version 2 along with this work; if not, write to the Free Software
        Foundation, Inc., 51 Franklin St, Fifth Floor, Boston, MA
        02110-1301 USA
        
        Please contact Sun Microsystems, Inc., 4150 Network Circle, Santa
        Clara, CA 95054 or visit www.sun.com if you need additional
        information or have any questions.
-->
<configuration>
<constants>
<constant_class Package="com.sun.midp.configurator" Name="Constants" Scope="public">

  <constant Type="int"
            Name="CHAM_WIDTH"
            Value="176"
            Comment="(Chameleon Only) display width (QVA PocketPC)"/>
  <constant Type="int"
            Name="CHAM_HEIGHT"
            Value="180"
            Comment="(Chameleon Only) display height (QVA PocketPC)"/>
  <constant Type="int"
            Name="CHAM_FULLHEIGHT"
            Value="180"
            Comment="(Chameleon Only) full display height (QVA PocketPC)"/>

  <constant Type="int"
            Name="FULLWIDTH"
            Value="176"
            Comment="(Fixed) full display width"/>
  <constant Type="int"
            Name="FULLHEIGHT"
            Value="180" 
            Comment="(Fixed) full display height"/>
  <constant Type="int"
            Name="NORMALWIDTH"
            Value="176" 
            Comment="(Fixed) normal width"/>
  <constant Type="int"
            Name="NORMALHEIGHT"
            Value="180" 
            Comment="(Fixed) normal height"/>

  <constant Type="int"
            Name="JWC_WINCE_SMARTPHONE"
            Value="1"
            Comment="Specify whether we are building for smartphone"/>
  <constant Type="int"
            Name="JWC_WINCE_TITLE_HEIGHT"
            Value="20"
            Comment="Height of the WinCE title at the top of LCD"/>
  <constant Type="int"
            Name="JWC_WINCE_MENU_HEIGHT"
            Value="20"
            Comment="Height of the WinCE menu at the bottom of LCD"/>

  <constant Type="int"
            Name="AMS_ITEM_WIDTH"
            Value="150"
            Comment="Width of item in AMS screen"/>
</constant_class>
</constants>
</configuration>
